<?xml version="1.0" encoding="UTF-8"?>
<!--Sample XML file generated by XMLSpy v2008 rel. 2 (http://www.altova.com)-->
<GameDescriptor xmlns:xsi="http://www.w3.org/2001/XMLSchema-instance" xsi:noNamespaceSchemaLocation="TexaxHoldem.xsd">
	<GameType>DynamicMultiPlayer</GameType>
	<Structure>
		<HandsCount>12</HandsCount>
		<Buy>100</Buy>
		<Blindes fixed="true" additions="2" max-total-rounds="10">
			<Big>6</Big>
			<Small>3</Small>
		</Blindes>
	</Structure>	
	<DynamicPlayers game-title="sample game" total-players="6"/>
</GameDescriptor>
